{
  "schema_version": "1.0.0",
  "session_id": "sess_l5_0001",
  "objective_id": "obj_l5_script",
  "created_at": "2026-02-06T13:30:00Z",
  "objective_name": "L5 script ideation, selection, translation, and narration extraction",
  "success_criteria": [
    "Generate multiple script candidates",
    "Select one script via score_spec_script",
    "Publish script_session_pack for L6 handoff"
  ],
  "score_spec_ref": "score_specs/score_spec_script.json",
  "policy_constraints": [
    "Use model map in manual update mode only",
    "Keep lock policy REAL > INFERRED > NO_INFO",
    "Avoid explicit graphic descriptions"
  ]
}
